[],,,False,monstron,,quantum,"[{'e': 'text', 't': 'Quantum'}]",65ee7b7e-18ab-11e7-8742-0e3cfa1139b6,Quantum,dark,richtext,t2_qa1rp,False,,,False,False,,False,,False,1560148003.0,1560119203.0,,self.boardgames,0,1560119414.0,0,{},False,False,bypzyx,False,False,False,False,True,True,False,,,review,"[{'e': 'text', 't': 'Review'}]",9beed2b0-4636-11e2-af77-12313b0ce1e2,Review,dark,richtext,False,,{},False,,,,[],t3_bypzyx,False,1,0,,False,all_ads,/r/boardgames/comments/bypzyx/memoir_44_a_new_flight_plan_a_component_review_of/,False,,,6,False,,,False,9,,{},"**Awww, what's in the box?**

NFP includes 16  Airplane Figures, 3 Airplane Stands, 30 Air Combat Cards, 8 Summary  Cards, 15 Nation Markers, 18 Machine Gun and 12 Bomb Markers, 1 Rules  booklet and 1 Scenario booklet with 21 new Scenarios.

What's important to notice here is that while the box includes an awesome amount of historical aircraft, ***it only includes*** ***3 airplane stands.*** Looking forward to epic air battles? Well, not with three stands. Memoir '44 is a ground warfare game, but this expansion is dedicated to air combat and includes at least three planes for every Memoir '44 faction. With so many planes in the box but not enough stands for even two factions to have all their planes in the air seems like a blatant attempt to force dedicated players to purchase two copies of the expansion. This is something avid Memoir '44 players do compulsively but it's a bit sad to see the expansion so hamstrung out of the gate.

Despite being scarce, the stands are well designed with a slot on them to place a visual marker to indicate what aircraft you have in play, which is really useful because ***all of the planes are the same color plastic***. Players not wanting to check a token to figure out what faction's plane is in the air will have to paint their models. I speed painted my planes to somewhat match the faction plastic for my ground forces, plus I color coded my planes' wingtips to match the Summary Cards to indicate if an aircraft is a fighter, a fighter-bomber, or a bomber. This might seem redundant, but there are several models that are somewhat in-between size wise which could make it difficult at first glance to figure out whether your armor units are at risk from an aircraft or not. This bit of reference paint solves a gameplay problem, but it does remove some of the realism from the painted aircraft.

The models themselves are satisfactory and on par with the rest of Memoir '44. The heavy bombers look great and were really fun to paint. The smaller fighters, on the other hand, lack detail and don't hold their shape well - several of the small fighters had bent tail ends. This was pretty mild, but noticeable. If you're a perfectionist you might want to use some hot water to try to set the models straight because I imagine most of the kits will have this problem. The small fighter models are also so tiny that I really worry about losing them.

The cards and markers are standard Memoir '44, with the Air Combat cards being treated as all other Combat Cards introduced in Winter Wars, Sword of Stalingrad, and Through Jungle and Desert. If you haven't played with Combat Cards before, then this will be new to you. What's cool is if you have these other expansions, you can mix and match Air Combat in with these other collections, making for some really interesting scenarios.

If you're a Memoir '44 fan and considering buying this set I would say you should ***maybe*** buy it. Do you own most of the other Combat cards? Then definitely buy it; the potential for fun and interesting Combat Card synergies is too good to pass up. Do you mostly play two players? Buy it if you're interested in seeing what a few planes can do to the battlefield but don't expect epic air duels due to a lack of stands. Do you mostly play Overlord? It seems like you need two copies to make the expansion Overlord-ready, but that is the case with most Memoir '44 expansions.

If you have any more questions about the components or other features of the expansion let me know. I can also provide some tips on how to paint your set in a few hours assuming you aren't picky about historical accuracy.","&lt;!-- SC_OFF --&gt;&lt;div class=""md""&gt;&lt;p&gt;&lt;strong&gt;Awww, what&amp;#39;s in the box?&lt;/strong&gt;&lt;/p&gt;

&lt;p&gt;NFP includes 16  Airplane Figures, 3 Airplane Stands, 30 Air Combat Cards, 8 Summary  Cards, 15 Nation Markers, 18 Machine Gun and 12 Bomb Markers, 1 Rules  booklet and 1 Scenario booklet with 21 new Scenarios.&lt;/p&gt;

&lt;p&gt;What&amp;#39;s important to notice here is that while the box includes an awesome amount of historical aircraft, &lt;strong&gt;&lt;em&gt;it only includes&lt;/em&gt;&lt;/strong&gt; &lt;strong&gt;&lt;em&gt;3 airplane stands.&lt;/em&gt;&lt;/strong&gt; Looking forward to epic air battles? Well, not with three stands. Memoir &amp;#39;44 is a ground warfare game, but this expansion is dedicated to air combat and includes at least three planes for every Memoir &amp;#39;44 faction. With so many planes in the box but not enough stands for even two factions to have all their planes in the air seems like a blatant attempt to force dedicated players to purchase two copies of the expansion. This is something avid Memoir &amp;#39;44 players do compulsively but it&amp;#39;s a bit sad to see the expansion so hamstrung out of the gate.&lt;/p&gt;

&lt;p&gt;Despite being scarce, the stands are well designed with a slot on them to place a visual marker to indicate what aircraft you have in play, which is really useful because &lt;strong&gt;&lt;em&gt;all of the planes are the same color plastic&lt;/em&gt;&lt;/strong&gt;. Players not wanting to check a token to figure out what faction&amp;#39;s plane is in the air will have to paint their models. I speed painted my planes to somewhat match the faction plastic for my ground forces, plus I color coded my planes&amp;#39; wingtips to match the Summary Cards to indicate if an aircraft is a fighter, a fighter-bomber, or a bomber. This might seem redundant, but there are several models that are somewhat in-between size wise which could make it difficult at first glance to figure out whether your armor units are at risk from an aircraft or not. This bit of reference paint solves a gameplay problem, but it does remove some of the realism from the painted aircraft.&lt;/p&gt;

&lt;p&gt;The models themselves are satisfactory and on par with the rest of Memoir &amp;#39;44. The heavy bombers look great and were really fun to paint. The smaller fighters, on the other hand, lack detail and don&amp;#39;t hold their shape well - several of the small fighters had bent tail ends. This was pretty mild, but noticeable. If you&amp;#39;re a perfectionist you might want to use some hot water to try to set the models straight because I imagine most of the kits will have this problem. The small fighter models are also so tiny that I really worry about losing them.&lt;/p&gt;

&lt;p&gt;The cards and markers are standard Memoir &amp;#39;44, with the Air Combat cards being treated as all other Combat Cards introduced in Winter Wars, Sword of Stalingrad, and Through Jungle and Desert. If you haven&amp;#39;t played with Combat Cards before, then this will be new to you. What&amp;#39;s cool is if you have these other expansions, you can mix and match Air Combat in with these other collections, making for some really interesting scenarios.&lt;/p&gt;

&lt;p&gt;If you&amp;#39;re a Memoir &amp;#39;44 fan and considering buying this set I would say you should &lt;strong&gt;&lt;em&gt;maybe&lt;/em&gt;&lt;/strong&gt; buy it. Do you own most of the other Combat cards? Then definitely buy it; the potential for fun and interesting Combat Card synergies is too good to pass up. Do you mostly play two players? Buy it if you&amp;#39;re interested in seeing what a few planes can do to the battlefield but don&amp;#39;t expect epic air duels due to a lack of stands. Do you mostly play Overlord? It seems like you need two copies to make the expansion Overlord-ready, but that is the case with most Memoir &amp;#39;44 expansions.&lt;/p&gt;

&lt;p&gt;If you have any more questions about the components or other features of the expansion let me know. I can also provide some tips on how to paint your set in a few hours assuming you aren&amp;#39;t picky about historical accuracy.&lt;/p&gt;
&lt;/div&gt;&lt;!-- SC_ON --&gt;",True,False,False,boardgames,t5_2qmjp,r/boardgames,1942592,public,,self,,,Memoir '44: A New Flight Plan - A component review of the new expansion.,0,9,https://www.reddit.com/r/boardgames/comments/bypzyx/memoir_44_a_new_flight_plan_a_component_review_of/,[],,False,all_ads,6
[],,,False,dpollere,,pandemic,"[{'e': 'text', 't': 'Pandemic'}]",553efa42-18ab-11e7-9756-0ed152d2be1c,Pandemic,dark,richtext,t2_rnelx,False,,,False,False,,False,,False,1560150875.0,1560122075.0,,self.boardgames,0,False,0,{},False,True,byqhq1,False,False,False,False,True,True,False,,,howto,"[{'e': 'text', 't': 'How-To/DIY'}]",00a3aaec-7138-11e7-82b7-0e38c8f4bbce,How-To/DIY,dark,richtext,False,,{},False,,,,[],t3_byqhq1,False,0,0,,False,all_ads,/r/boardgames/comments/byqhq1/organizer_i_made_for_sidereal_confluence_out_of/,False,self,"{'images': [{'source': {'url': 'https://external-preview.redd.it/xKxTvHT93hMipbhq2fgLbeGL-P8XTyfuZyorGSwWhXo.jpg?auto=webp&amp;s=e70313b9f1b46ec88f040cff02d3e6f96e81ca18', 'width': 1536, 'height': 2048}, 'resolutions': [{'url': 'https://external-preview.redd.it/xKxTvHT93hMipbhq2fgLbeGL-P8XTyfuZyorGSwWhXo.jpg?width=108&amp;crop=smart&amp;auto=webp&amp;s=1d90a95cc1836f30261fa9b1f9ad335aaac207ca', 'width': 108, 'height': 144}, {'url': 'https://external-preview.redd.it/xKxTvHT93hMipbhq2fgLbeGL-P8XTyfuZyorGSwWhXo.jpg?width=216&amp;crop=smart&amp;auto=webp&amp;s=c3a1e3249da71de78e15d78089e0329777046223', 'width': 216, 'height': 288}, {'url': 'https://external-preview.redd.it/xKxTvHT93hMipbhq2fgLbeGL-P8XTyfuZyorGSwWhXo.jpg?width=320&amp;crop=smart&amp;auto=webp&amp;s=bbf8f1588a24a5d2decf5a4644f34529e3c6b0c4', 'width': 320, 'height': 426}, {'url': 'https://external-preview.redd.it/xKxTvHT93hMipbhq2fgLbeGL-P8XTyfuZyorGSwWhXo.jpg?width=640&amp;crop=smart&amp;auto=webp&amp;s=9e0778765915cbe0d27537da7e4b65cb22b54465', 'width': 640, 'height': 853}, {'url': 'https://external-preview.redd.it/xKxTvHT93hMipbhq2fgLbeGL-P8XTyfuZyorGSwWhXo.jpg?width=960&amp;crop=smart&amp;auto=webp&amp;s=8a8cc455803df43dc06515d2d30b0dcfc63db817', 'width': 960, 'height': 1280}, {'url': 'https://external-preview.redd.it/xKxTvHT93hMipbhq2fgLbeGL-P8XTyfuZyorGSwWhXo.jpg?width=1080&amp;crop=smart&amp;auto=webp&amp;s=15aeef5422ce55436e5e69fbc6f79f315ac2c438', 'width': 1080, 'height': 1440}], 'variants': {}, 'id': 'bBra0xzwumemPuJzyb8XqgFciTIVXEN4-x0E1iyZyxQ'}], 'enabled': False}",6,False,,,False,6,,{},"

[Sidereal Confluence Insert](https://imgur.com/gallery/tWFjJq9)

I’ve made a few of these now. I find them super helpful for set up / take down. What do you guys think? Ever made or considered making an organizer for any of your games?","&lt;!-- SC_OFF --&gt;&lt;div class=""md""&gt;&lt;p&gt;&lt;a href=""https://imgur.com/gallery/tWFjJq9""&gt;Sidereal Confluence Insert&lt;/a&gt;&lt;/p&gt;

&lt;p&gt;I’ve made a few of these now. I find them super helpful for set up / take down. What do you guys think? Ever made or considered making an organizer for any of your games?&lt;/p&gt;
&lt;/div&gt;&lt;!-- SC_ON --&gt;",True,False,False,boardgames,t5_2qmjp,r/boardgames,1942592,public,,self,,,Organizer I made for Sidereal Confluence out of foamcore,0,6,https://www.reddit.com/r/boardgames/comments/byqhq1/organizer_i_made_for_sidereal_confluence_out_of/,[],,False,all_ads,6
[],,,False,Panigg,,,[],,,,text,t2_6m3pf,False,,,False,False,,False,,False,1560127947.0,1560099147.0,,reddit.com,0,False,0,{},False,False,bym97e,False,False,False,False,True,False,False,,,,[],,,dark,text,False,,{},False,,,,[],t3_bym97e,False,0,0,,False,all_ads,/r/boardgames/comments/bym97e/xpost_from_rberlinsocialclub_looking_for_board/,False,link,"{'images': [{'source': {'url': 'https://external-preview.redd.it/iPEWVLG8v3VmacBbb3322tHdOPByroNU-e-5fRl8qjY.jpg?auto=webp&amp;s=9f9de938d6e79ca0f698851011caa142db025de4', 'width': 256, 'height': 256}, 'resolutions': [{'url': 'https://external-preview.redd.it/iPEWVLG8v3VmacBbb3322tHdOPByroNU-e-5fRl8qjY.jpg?width=108&amp;crop=smart&amp;auto=webp&amp;s=d36a9c36f59aebf4e96ebacf9cad3c207131c2ff', 'width': 108, 'height': 108}, {'url': 'https://external-preview.redd.it/iPEWVLG8v3VmacBbb3322tHdOPByroNU-e-5fRl8qjY.jpg?width=216&amp;crop=smart&amp;auto=webp&amp;s=64c1f6c0337c810084a3ad5e777cd3aea89f89f1', 'width': 216, 'height': 216}], 'variants': {}, 'id': 'tYcca__B981Md52bBlfvfdo-MlQiCaKlQY9HNUmxlkw'}], 'enabled': False}",6,False,,,False,17,,{},,,True,False,False,boardgames,t5_2qmjp,r/boardgames,1942592,public,,https://b.thumbs.redditmedia.com/kLul-ybpmt3bWrDVONQOMuUwP0ei5GoMk7heu2pm-8Q.jpg,140.0,140.0,"Xpost from r/berlinsocialclub - Looking for Board Gamers from Berlin, Germany, interested in testing a new game.",0,17,https://www.reddit.com/r/berlinsocialclub/comments/bym5sk/looking_for_board_gamers_in_berlin_to_playtest/,[],,False,all_ads,6
[],,,False,ya_bebto,,,[],,,,text,t2_9ckpjxl,False,,,False,False,,False,,False,1560138269.0,1560109469.0,,self.boardgames,0,False,0,{},False,False,byo7a5,False,False,False,False,True,True,False,,,,[],,,dark,text,False,,{},False,,,,[],t3_byo7a5,False,8,0,,False,all_ads,/r/boardgames/comments/byo7a5/extensive_monopoly_analysis/,False,,,6,False,,,False,10,,{},"I wanted my friends to stop suggesting we play Monopoly, so I [broke down the game and made a write-up](https://drive.google.com/drive/folders/1P1ueHHNn_ea_F7AG9BjqqCH80fJutxSM?usp=sharing).

It's really easy to compare prices to profits on properties, but players are funneled to specific areas of the board, so i modeled players moving about the board to give a better metric for comparing properties, which is all done in excel tables which are available.  I don't have experience using VBA or custom functions in excel, so if you poke around the formulas in the tables for modeling player movement they'll look like a mess of cell references and multipliers, and I can explain what each part does if someone plans on editing it or wants to mess with it.  I also talked about monopolizing the house market in the game, which is a very devious strategy that can lock down the game with the two cheapest property sets.

I really hate monopoly because it takes forever and there are very few interesting decisions you have to make during the game, as movement is entirely random (excluding choosing how to escape jail), and movement essentially determines what happens to you in the game

Also i might be slightly colorblind because I call the second set of properties grey but everyone else seems to call them light blue?","&lt;!-- SC_OFF --&gt;&lt;div class=""md""&gt;&lt;p&gt;I wanted my friends to stop suggesting we play Monopoly, so I &lt;a href=""https://drive.google.com/drive/folders/1P1ueHHNn_ea_F7AG9BjqqCH80fJutxSM?usp=sharing""&gt;broke down the game and made a write-up&lt;/a&gt;.&lt;/p&gt;

&lt;p&gt;It&amp;#39;s really easy to compare prices to profits on properties, but players are funneled to specific areas of the board, so i modeled players moving about the board to give a better metric for comparing properties, which is all done in excel tables which are available.  I don&amp;#39;t have experience using VBA or custom functions in excel, so if you poke around the formulas in the tables for modeling player movement they&amp;#39;ll look like a mess of cell references and multipliers, and I can explain what each part does if someone plans on editing it or wants to mess with it.  I also talked about monopolizing the house market in the game, which is a very devious strategy that can lock down the game with the two cheapest property sets.&lt;/p&gt;

&lt;p&gt;I really hate monopoly because it takes forever and there are very few interesting decisions you have to make during the game, as movement is entirely random (excluding choosing how to escape jail), and movement essentially determines what happens to you in the game&lt;/p&gt;

&lt;p&gt;Also i might be slightly colorblind because I call the second set of properties grey but everyone else seems to call them light blue?&lt;/p&gt;
&lt;/div&gt;&lt;!-- SC_ON --&gt;",True,False,False,boardgames,t5_2qmjp,r/boardgames,1942592,public,,self,,,Extensive Monopoly Analysis,0,10,https://www.reddit.com/r/boardgames/comments/byo7a5/extensive_monopoly_analysis/,[],,False,all_ads,6
[],,,False,PotNoodlePolypeptide,,,[],,,,text,t2_3sux3zmv,False,,,False,False,,False,,False,1560138413.0,1560109613.0,,self.boardgames,0,False,0,{},False,False,byo87y,False,False,False,False,True,True,False,,,,[],,,dark,text,False,,{},False,,,,[],t3_byo87y,False,15,0,,False,all_ads,/r/boardgames/comments/byo87y/does_any_one_know_of_any_organised_holidays_for/,False,,,6,False,,,False,10,,{},"Anywhere, anytime 😊 I haven’t been able to find out about one so far","&lt;!-- SC_OFF --&gt;&lt;div class=""md""&gt;&lt;p&gt;Anywhere, anytime 😊 I haven’t been able to find out about one so far&lt;/p&gt;
&lt;/div&gt;&lt;!-- SC_ON --&gt;",True,False,False,boardgames,t5_2qmjp,r/boardgames,1942592,public,,self,,,Does any one know of any organised holidays for board gamers?,0,10,https://www.reddit.com/r/boardgames/comments/byo87y/does_any_one_know_of_any_organised_holidays_for/,[],,False,all_ads,6
[],,,False,kierco_2002,#edeff1,,"[{'a': ':spirit_island:', 'e': 'emoji', 'u': 'https://emoji.redditmedia.com/5dhccdeqncf11_t5_2qmjp/spirit_island'}, {'e': 'text', 't': ' Spirit Island'}]",2fdfa772-9cf0-11e8-922c-0e3a76b3c6b0,:spirit_island: Spirit Island,dark,richtext,t2_6hkkk,False,,,False,False,,False,,False,1560109085.0,1560080285.0,,self.boardgames,0,False,0,{},False,False,byjd6l,False,False,False,False,True,True,False,,,,"[{'e': 'text', 't': 'COMC'}]",734914a6-426b-11e8-8511-0e863647358e,COMC,dark,richtext,False,,{},False,,,,[],t3_byjd6l,False,16,0,,False,all_ads,/r/boardgames/comments/byjd6l/comc_been_in_the_hobby_for_about_5_years_now/,False,self,"{'images': [{'source': {'url': 'https://external-preview.redd.it/5vE8B8vUDdqzOdk851lCmEZB85sEcfnA88QKuE1NNFk.jpg?auto=webp&amp;s=44bf5a4615b4e22c6a5b1e35fce40e6e4e39454f', 'width': 1080, 'height': 1073}, 'resolutions': [{'url': 'https://external-preview.redd.it/5vE8B8vUDdqzOdk851lCmEZB85sEcfnA88QKuE1NNFk.jpg?width=108&amp;crop=smart&amp;auto=webp&amp;s=1adeed9840675bfd7457e3934bd0a7591b7e6942', 'width': 108, 'height': 107}, {'url': 'https://external-preview.redd.it/5vE8B8vUDdqzOdk851lCmEZB85sEcfnA88QKuE1NNFk.jpg?width=216&amp;crop=smart&amp;auto=webp&amp;s=30dcd29723a16ee6eca94b47ff991d9acca4f967', 'width': 216, 'height': 214}, {'url': 'https://external-preview.redd.it/5vE8B8vUDdqzOdk851lCmEZB85sEcfnA88QKuE1NNFk.jpg?width=320&amp;crop=smart&amp;auto=webp&amp;s=30de61db2cf1d9b39452ef4d2bfbfb88dabe5a21', 'width': 320, 'height': 317}, {'url': 'https://external-preview.redd.it/5vE8B8vUDdqzOdk851lCmEZB85sEcfnA88QKuE1NNFk.jpg?width=640&amp;crop=smart&amp;auto=webp&amp;s=f2926e124b83d6ed85ded9b4d3a22c971e92524a', 'width': 640, 'height': 635}, {'url': 'https://external-preview.redd.it/5vE8B8vUDdqzOdk851lCmEZB85sEcfnA88QKuE1NNFk.jpg?width=960&amp;crop=smart&amp;auto=webp&amp;s=6fd819d124432349ab3c2eb6847a911c2856f25a', 'width': 960, 'height': 953}, {'url': 'https://external-preview.redd.it/5vE8B8vUDdqzOdk851lCmEZB85sEcfnA88QKuE1NNFk.jpg?width=1080&amp;crop=smart&amp;auto=webp&amp;s=9f26696dc1d37221bed43177300495d7dda65ecb', 'width': 1080, 'height': 1073}], 'variants': {}, 'id': 'bBhaoTOaWkwcvvqopmo2sCeVj1aho6JvpSRt_yBWrRQ'}], 'enabled': False}",6,False,,,False,35,,{},"https://imgur.com/a/9oQHk4g

While I feel that I buy a lot of games, in the grand scheme of things it's not that bad. Lots of my smaller games and stuff on the bottom shelf was found in thrift shops (besieged for 10 bux, still my best find to date).

In the next few months I'm going to cull about a quarter of this to bankroll new stuff and make space for upcoming kickstarter projects. Probably get rid of Nerath, Axis and allies, Rick and morty, broom service, and munchkin. 

**favourite games?**
It changes when I buy something new, I'll usually get super into something for a few months then move onto the next thing. Playing a lot of anachrony now but my oldest game, Betrayal at house on the hill, will probably still be my favourite 

**things I would change?**
I think I would like to get more ""smaller games.""usually i gravitate towards complex big box stuff but find i never really want to play anything of the quick games ( skyfall, munchkin, king of New York). So finding some small box big experience games may be in my future","&lt;!-- SC_OFF --&gt;&lt;div class=""md""&gt;&lt;p&gt;&lt;a href=""https://imgur.com/a/9oQHk4g""&gt;https://imgur.com/a/9oQHk4g&lt;/a&gt;&lt;/p&gt;

&lt;p&gt;While I feel that I buy a lot of games, in the grand scheme of things it&amp;#39;s not that bad. Lots of my smaller games and stuff on the bottom shelf was found in thrift shops (besieged for 10 bux, still my best find to date).&lt;/p&gt;

&lt;p&gt;In the next few months I&amp;#39;m going to cull about a quarter of this to bankroll new stuff and make space for upcoming kickstarter projects. Probably get rid of Nerath, Axis and allies, Rick and morty, broom service, and munchkin. &lt;/p&gt;

&lt;p&gt;&lt;strong&gt;favourite games?&lt;/strong&gt;
It changes when I buy something new, I&amp;#39;ll usually get super into something for a few months then move onto the next thing. Playing a lot of anachrony now but my oldest game, Betrayal at house on the hill, will probably still be my favourite &lt;/p&gt;

&lt;p&gt;&lt;strong&gt;things I would change?&lt;/strong&gt;
I think I would like to get more &amp;quot;smaller games.&amp;quot;usually i gravitate towards complex big box stuff but find i never really want to play anything of the quick games ( skyfall, munchkin, king of New York). So finding some small box big experience games may be in my future&lt;/p&gt;
&lt;/div&gt;&lt;!-- SC_ON --&gt;",True,False,False,boardgames,t5_2qmjp,r/boardgames,1942592,public,,self,,,"[COMC] been in the hobby for about 5 years now, relocated my video games to make more shelf room",0,35,https://www.reddit.com/r/boardgames/comments/byjd6l/comc_been_in_the_hobby_for_about_5_years_now/,[],,False,all_ads,6
[],,,False,SamWiseTreebeard,,,[],,,,text,t2_35u5mqay,False,,,False,False,,False,,False,1560142680.0,1560113880.0,,self.boardgames,0,False,0,{},False,False,byp0zy,False,False,False,False,True,True,False,,,,[],,,dark,text,False,,{},False,,,,[],t3_byp0zy,True,5,0,,False,all_ads,/r/boardgames/comments/byp0zy/taboo_question/,False,,,6,False,,,False,6,,{},"When playing taboo, if the guesser says one of the taboo words on the list, can the person giving the clues now use that word or is that word still off-limits?","&lt;!-- SC_OFF --&gt;&lt;div class=""md""&gt;&lt;p&gt;When playing taboo, if the guesser says one of the taboo words on the list, can the person giving the clues now use that word or is that word still off-limits?&lt;/p&gt;
&lt;/div&gt;&lt;!-- SC_ON --&gt;",True,False,False,boardgames,t5_2qmjp,r/boardgames,1942592,public,,self,,,Taboo Question,0,6,https://www.reddit.com/r/boardgames/comments/byp0zy/taboo_question/,[],,False,all_ads,6
[],,,False,Hallormour,,,[],,,,text,t2_11y7ba,False,,,False,False,,False,,False,1560133088.0,1560104288.0,,self.boardgames,0,False,0,{},False,False,byn81v,False,False,False,False,True,True,False,,#edeff1,,"[{'e': 'text', 't': 'Question'}]",ce696ba0-b792-11e8-9508-0ed1a4fbdca2,Question,dark,richtext,False,,{},False,,,,[],t3_byn81v,False,3,0,,False,all_ads,/r/boardgames/comments/byn81v/feast_for_odin_used_materials/,False,,,6,False,,,False,10,,{},"Quick question: Do used materials go back to the general reserve or to the mountain tiles?

Thanks!","&lt;!-- SC_OFF --&gt;&lt;div class=""md""&gt;&lt;p&gt;Quick question: Do used materials go back to the general reserve or to the mountain tiles?&lt;/p&gt;

&lt;p&gt;Thanks!&lt;/p&gt;
&lt;/div&gt;&lt;!-- SC_ON --&gt;",True,False,False,boardgames,t5_2qmjp,r/boardgames,1942592,public,,self,,,Feast for Odin: Used materials,0,10,https://www.reddit.com/r/boardgames/comments/byn81v/feast_for_odin_used_materials/,[],,False,all_ads,6
[],,,False,TheDoritosPope,,,[],,,,text,t2_3zxjp8,False,,,False,False,,False,,False,1560121936.0,1560093136.0,,self.boardgames,0,False,0,{},False,False,byl6oy,False,False,False,False,True,True,False,,#edeff1,,"[{'e': 'text', 't': 'Question'}]",ce696ba0-b792-11e8-9508-0ed1a4fbdca2,Question,dark,richtext,False,,{},False,,,,[],t3_byl6oy,False,4,0,,False,all_ads,/r/boardgames/comments/byl6oy/looking_for_the_clipon_rings_from_hateblood_rage/,False,,,6,False,,,False,14,,{},I am in desperate need of those colored rings from CMON's HATE/Blood Rage boardgame.,"&lt;!-- SC_OFF --&gt;&lt;div class=""md""&gt;&lt;p&gt;I am in desperate need of those colored rings from CMON&amp;#39;s HATE/Blood Rage boardgame.&lt;/p&gt;
&lt;/div&gt;&lt;!-- SC_ON --&gt;",True,False,False,boardgames,t5_2qmjp,r/boardgames,1942592,public,,self,,,Looking for the clip-on rings from HATE/Blood Rage,0,14,https://www.reddit.com/r/boardgames/comments/byl6oy/looking_for_the_clipon_rings_from_hateblood_rage/,[],,False,all_ads,6
