all_awardings,approved_at_utc,approved_by,archived,author,author_flair_background_color,author_flair_css_class,author_flair_richtext,author_flair_template_id,author_flair_text,author_flair_text_color,author_flair_type,author_fullname,author_patreon_flair,banned_at_utc,banned_by,can_gild,can_mod_post,category,clicked,content_categories,contest_mode,created,created_utc,distinguished,domain,downs,edited,gilded,gildings,hidden,hide_score,id,is_crosspostable,is_meta,is_original_content,is_reddit_media_domain,is_robot_indexable,is_self,is_video,likes,link_flair_background_color,link_flair_css_class,link_flair_richtext,link_flair_template_id,link_flair_text,link_flair_text_color,link_flair_type,locked,media,media_embed,media_only,mod_note,mod_reason_by,mod_reason_title,mod_reports,name,no_follow,num_comments,num_crossposts,num_reports,over_18,parent_whitelist_status,permalink,pinned,post_hint,preview,pwls,quarantine,removal_reason,report_reasons,saved,score,secure_media,secure_media_embed,selftext,selftext_html,send_replies,spoiler,stickied,subreddit,subreddit_id,subreddit_name_prefixed,subreddit_subscribers,subreddit_type,suggested_sort,thumbnail,thumbnail_height,thumbnail_width,title,total_awards_received,ups,url,user_reports,view_count,visited,whitelist_status,wls
[],,,False,AutoModerator,#d0fffd,,"[{'e': 'text', 't': '🤖'}]",326005ee-9cf2-11e8-8b1f-0e8f9a199476,🤖,dark,richtext,t2_6l4z3,False,,,False,False,,False,,False,1560085317.0,1560056517.0,moderator,self.boardgames,0,False,0,{},False,False,bygudt,False,False,False,False,True,True,False,,#4a4b4a,,"[{'e': 'text', 't': 'Daily Game Recs'}]",01476204-cd40-11e7-a8ba-0e829f432fc8,Daily Game Recs,light,richtext,False,,{},False,,,,[],t3_bygudt,True,71,1,,False,all_ads,/r/boardgames/comments/bygudt/rboardgames_daily_discussion_and_game/,False,,,6,False,,,False,8,,{},"**Welcome to /r/boardgames Daily Discussion and Game Recommendations**

This is meant to be a place where you can ask any and all questions relating to the board gaming world: general or specific game recommendations, rule clarifications, definitions of terms/acronyms, and other quick questions that might not warrant their own post. 

If you are seeking game recommendations you will get better responses if you give us enough background to help you. You can use [this template](https://www.reddit.com/r/boardgames/wiki/personalized-game-recommendation-template-no-explainer) to do so. [Here](https://www.reddit.com/r/boardgames/wiki/personalized-game-recommendation-template) is a version with explanations of what we're looking for.  

If you reply to any comment that has a game name in **bold** with ""**/u/r2d8 getparentinfo**"", one of our robots will tell you more about the game

Just remember that this is a community full of awesome, helpful people, and feel free to ask your questions whatever they may be. As always, keep it civil and remember what the downvote button is actually for.


Lastly, here are some of the resources available at /r/boardgames:

* If you are new here, be sure to check out our [Community Guidelines](https://www.reddit.com/r/boardgames/wiki/community)
* If you are looking for a game recommendation, make sure to read our [What Should I Get Wiki](https://www.reddit.com/r/boardgames/wiki/wsig)
* If asking people for recommendations is too interactive: [The Automated Recommendations Robot is here for you](https://www.reddit.com/r/boardgames/wiki/wsig#wiki_ask_a_robot_for_a_list_of_recommendations).
* Also take a look at our [Wiki Index](https://www.reddit.com/r/boardgames/wiki/index) for various other resources and information.
* Any questions about game design can be answered here, but also visit /r/tabletopgamedesign
* Any discussions about the subreddit itself should be contained in /r/metaboardgames

*If you use the boardgamerecommender bot in this thread, please reply to the stickied top comment in order to avoid cluttering up the posts.*

Happy gaming!","&lt;!-- SC_OFF --&gt;&lt;div class=""md""&gt;&lt;p&gt;&lt;strong&gt;Welcome to &lt;a href=""/r/boardgames""&gt;/r/boardgames&lt;/a&gt; Daily Discussion and Game Recommendations&lt;/strong&gt;&lt;/p&gt;

&lt;p&gt;This is meant to be a place where you can ask any and all questions relating to the board gaming world: general or specific game recommendations, rule clarifications, definitions of terms/acronyms, and other quick questions that might not warrant their own post. &lt;/p&gt;

&lt;p&gt;If you are seeking game recommendations you will get better responses if you give us enough background to help you. You can use &lt;a href=""https://www.reddit.com/r/boardgames/wiki/personalized-game-recommendation-template-no-explainer""&gt;this template&lt;/a&gt; to do so. &lt;a href=""https://www.reddit.com/r/boardgames/wiki/personalized-game-recommendation-template""&gt;Here&lt;/a&gt; is a version with explanations of what we&amp;#39;re looking for.  &lt;/p&gt;

&lt;p&gt;If you reply to any comment that has a game name in &lt;strong&gt;bold&lt;/strong&gt; with &amp;quot;&lt;strong&gt;&lt;a href=""/u/r2d8""&gt;/u/r2d8&lt;/a&gt; getparentinfo&lt;/strong&gt;&amp;quot;, one of our robots will tell you more about the game&lt;/p&gt;

&lt;p&gt;Just remember that this is a community full of awesome, helpful people, and feel free to ask your questions whatever they may be. As always, keep it civil and remember what the downvote button is actually for.&lt;/p&gt;

&lt;p&gt;Lastly, here are some of the resources available at &lt;a href=""/r/boardgames""&gt;/r/boardgames&lt;/a&gt;:&lt;/p&gt;

&lt;ul&gt;
&lt;li&gt;If you are new here, be sure to check out our &lt;a href=""https://www.reddit.com/r/boardgames/wiki/community""&gt;Community Guidelines&lt;/a&gt;&lt;/li&gt;
&lt;li&gt;If you are looking for a game recommendation, make sure to read our &lt;a href=""https://www.reddit.com/r/boardgames/wiki/wsig""&gt;What Should I Get Wiki&lt;/a&gt;&lt;/li&gt;
&lt;li&gt;If asking people for recommendations is too interactive: &lt;a href=""https://www.reddit.com/r/boardgames/wiki/wsig#wiki_ask_a_robot_for_a_list_of_recommendations""&gt;The Automated Recommendations Robot is here for you&lt;/a&gt;.&lt;/li&gt;
&lt;li&gt;Also take a look at our &lt;a href=""https://www.reddit.com/r/boardgames/wiki/index""&gt;Wiki Index&lt;/a&gt; for various other resources and information.&lt;/li&gt;
&lt;li&gt;Any questions about game design can be answered here, but also visit &lt;a href=""/r/tabletopgamedesign""&gt;/r/tabletopgamedesign&lt;/a&gt;&lt;/li&gt;
&lt;li&gt;Any discussions about the subreddit itself should be contained in &lt;a href=""/r/metaboardgames""&gt;/r/metaboardgames&lt;/a&gt;&lt;/li&gt;
&lt;/ul&gt;

&lt;p&gt;&lt;em&gt;If you use the boardgamerecommender bot in this thread, please reply to the stickied top comment in order to avoid cluttering up the posts.&lt;/em&gt;&lt;/p&gt;

&lt;p&gt;Happy gaming!&lt;/p&gt;
&lt;/div&gt;&lt;!-- SC_ON --&gt;",False,False,True,boardgames,t5_2qmjp,r/boardgames,1942592,public,new,self,,,"/r/boardgames Daily Discussion and Game Recommendations (June 09, 2019)",0,8,https://www.reddit.com/r/boardgames/comments/bygudt/rboardgames_daily_discussion_and_game/,[],,False,all_ads,6
[],,,False,princeofropes,,,[],,,,text,t2_ttabv,False,,,False,False,,False,,False,1560124394.0,1560095594.0,,self.boardgames,0,False,0,{},False,False,bylm4i,False,False,False,False,True,True,False,,,,[],,,dark,text,False,,{},False,,,,[],t3_bylm4i,False,366,0,,False,all_ads,/r/boardgames/comments/bylm4i/what_is_the_biggest_argument_row_fight_you_ever/,False,,,6,False,,,False,282,,{},"Since getting into the hobby revently, and playing games with a lot of different randomers, I've noticed that tense exchanges are common, as people with clashing personalities sometimes end up in the same game.","&lt;!-- SC_OFF --&gt;&lt;div class=""md""&gt;&lt;p&gt;Since getting into the hobby revently, and playing games with a lot of different randomers, I&amp;#39;ve noticed that tense exchanges are common, as people with clashing personalities sometimes end up in the same game.&lt;/p&gt;
&lt;/div&gt;&lt;!-- SC_ON --&gt;",True,False,False,boardgames,t5_2qmjp,r/boardgames,1942592,public,,self,,,"What is the biggest argument/ row/ fight you ever had, or witnessed, over a boardgame?",0,282,https://www.reddit.com/r/boardgames/comments/bylm4i/what_is_the_biggest_argument_row_fight_you_ever/,[],,False,all_ads,6
[],,,False,Zelbinian,,san-juan,"[{'e': 'text', 't': 'L-index: 12'}]",815b4d38-18ab-11e7-b3d9-0ed78322c06a,L-index: 12,dark,richtext,t2_37o2w,False,,,False,False,,False,,False,1560129504.0,1560100704.0,,self.boardgames,0,False,0,{},False,False,bymjq2,False,False,False,False,True,True,False,,#7700aa,ksru,"[{'e': 'text', 't': 'KS Roundup'}]",182b2522-cd41-11e7-961e-0e93cb66b0b4,KS Roundup,light,richtext,False,,{},False,,,,[],t3_bymjq2,False,88,0,,False,all_ads,/r/boardgames/comments/bymjq2/discuss_this_weeks_kickstarter_games/,False,,,6,False,,,False,95,,{},"Apologies, I may not be able to post the lists today and, if I do, it'll be quite late. So for now it's up to you, Reddit! What projects are you currently excited about and what ones do you think people should avoid?","&lt;!-- SC_OFF --&gt;&lt;div class=""md""&gt;&lt;p&gt;Apologies, I may not be able to post the lists today and, if I do, it&amp;#39;ll be quite late. So for now it&amp;#39;s up to you, Reddit! What projects are you currently excited about and what ones do you think people should avoid?&lt;/p&gt;
&lt;/div&gt;&lt;!-- SC_ON --&gt;",True,False,False,boardgames,t5_2qmjp,r/boardgames,1942592,public,,self,,,Discuss this week's Kickstarter games!,0,95,https://www.reddit.com/r/boardgames/comments/bymjq2/discuss_this_weeks_kickstarter_games/,[],,False,all_ads,6
[],,,False,american-titan,,,[],,,,text,t2_swl8d,False,,,False,False,,False,,False,1560129814.0,1560101014.0,,self.boardgames,0,False,0,{},False,False,bymlqc,False,False,False,False,True,True,False,,,deal,"[{'e': 'text', 't': 'Deal'}]",a5cb0ebe-638d-11e3-aa0f-12313b04ceaf,Deal,dark,richtext,False,,{},False,,,,[],t3_bymlqc,False,31,0,,False,all_ads,/r/boardgames/comments/bymlqc/buy_2_get_one_free_on_board_games_at_target/,False,,,6,False,,,False,78,,{},Just saw a sign at my local Target. Might want to call into yours and see,"&lt;!-- SC_OFF --&gt;&lt;div class=""md""&gt;&lt;p&gt;Just saw a sign at my local Target. Might want to call into yours and see&lt;/p&gt;
&lt;/div&gt;&lt;!-- SC_ON --&gt;",True,False,False,boardgames,t5_2qmjp,r/boardgames,1942592,public,,self,,,Buy 2 Get One Free on Board Games at Target,0,78,https://www.reddit.com/r/boardgames/comments/bymlqc/buy_2_get_one_free_on_board_games_at_target/,[],,False,all_ads,6
[],,,False,XboxSylix,#edeff1,,"[{'a': ':spirit_island:', 'e': 'emoji', 'u': 'https://emoji.redditmedia.com/5dhccdeqncf11_t5_2qmjp/spirit_island'}, {'e': 'text', 't': ' Spirit Island'}]",2fdfa772-9cf0-11e8-922c-0e3a76b3c6b0,:spirit_island: Spirit Island,dark,richtext,t2_qpgwz,False,,,False,False,,False,,False,1560059548.0,1560030748.0,,self.boardgames,0,False,0,{},False,False,byd1mr,False,False,False,False,True,True,False,,,,[],,,dark,text,False,,{},False,,,,[],t3_byd1mr,False,242,0,,False,all_ads,/r/boardgames/comments/byd1mr/you_know_what_would_be_nice_a_simple_onepager/,False,,,6,False,,,False,1616,,{},"Bit of a rant, but I had a few KS games arrive this week all at once and it brought to light a long held frustration. 

Often times I get done punching out the chits and sit there looking at this thinking, “how the hell to organize this?”  Should I create starting player baggies? Do I need to Tetris the chits in a certain way to get the lid to shut, or do I need to put my spare punchboards underneath to avoid a gap?  Why are there 12 baggies when it seems like I need 5? Or, more often, the reverse.  I usually google a “how it fits” with moderate success, but not always.  

Maybe I’m crazy, but Why not include a simple one pager that shows how to do that? clearly designers think about this as they playtest their copies and have developed decent systems for organizing the games for play.  Maybe the logistics guys can do it and throw it in the box so you have time to play with the real production copy before developing the page. I know it isn’t free, but I can’t imagine throwing a single page in the shipping box is going to break anyone. Or maybe just post a quick YouTube video and then you have basically no cost.","&lt;!-- SC_OFF --&gt;&lt;div class=""md""&gt;&lt;p&gt;Bit of a rant, but I had a few KS games arrive this week all at once and it brought to light a long held frustration. &lt;/p&gt;

&lt;p&gt;Often times I get done punching out the chits and sit there looking at this thinking, “how the hell to organize this?”  Should I create starting player baggies? Do I need to Tetris the chits in a certain way to get the lid to shut, or do I need to put my spare punchboards underneath to avoid a gap?  Why are there 12 baggies when it seems like I need 5? Or, more often, the reverse.  I usually google a “how it fits” with moderate success, but not always.  &lt;/p&gt;

&lt;p&gt;Maybe I’m crazy, but Why not include a simple one pager that shows how to do that? clearly designers think about this as they playtest their copies and have developed decent systems for organizing the games for play.  Maybe the logistics guys can do it and throw it in the box so you have time to play with the real production copy before developing the page. I know it isn’t free, but I can’t imagine throwing a single page in the shipping box is going to break anyone. Or maybe just post a quick YouTube video and then you have basically no cost.&lt;/p&gt;
&lt;/div&gt;&lt;!-- SC_ON --&gt;",True,False,False,boardgames,t5_2qmjp,r/boardgames,1942592,public,,self,,,You know what would be nice? A simple one-pager that explains how tf you’re supposed to fit a game into the box after you’ve punched it,0,1616,https://www.reddit.com/r/boardgames/comments/byd1mr/you_know_what_would_be_nice_a_simple_onepager/,[],,False,all_ads,6
[],,,False,IveComeToKickass,,,[],,,,text,t2_2je2cpnu,False,,,False,False,,False,,False,1560110258.0,1560081458.0,,self.boardgames,0,False,0,{},False,False,byji0i,False,False,False,False,True,True,False,,,,[],,,dark,text,False,,{},False,,,,[],t3_byji0i,False,52,0,,False,all_ads,/r/boardgames/comments/byji0i/new_contrast_paints_paint_your_miniature_backlog/,False,self,"{'images': [{'source': {'url': 'https://external-preview.redd.it/sdzt-fx5kPkYezyFYbQxT6Mh6VFIKI845bktLWH_smw.jpg?auto=webp&amp;s=4b7fc544f6f53916d0c5102684c1c22becbc8313', 'width': 1000, 'height': 500}, 'resolutions': [{'url': 'https://external-preview.redd.it/sdzt-fx5kPkYezyFYbQxT6Mh6VFIKI845bktLWH_smw.jpg?width=108&amp;crop=smart&amp;auto=webp&amp;s=5f30a99a1bee94313bc9e725a771c48e677c32c9', 'width': 108, 'height': 54}, {'url': 'https://external-preview.redd.it/sdzt-fx5kPkYezyFYbQxT6Mh6VFIKI845bktLWH_smw.jpg?width=216&amp;crop=smart&amp;auto=webp&amp;s=fa5ec86ef36b303ac2f885a3299a20a1a5eac5d6', 'width': 216, 'height': 108}, {'url': 'https://external-preview.redd.it/sdzt-fx5kPkYezyFYbQxT6Mh6VFIKI845bktLWH_smw.jpg?width=320&amp;crop=smart&amp;auto=webp&amp;s=74203c41fd0c8c4f0d72965cf788ad06c3004f15', 'width': 320, 'height': 160}, {'url': 'https://external-preview.redd.it/sdzt-fx5kPkYezyFYbQxT6Mh6VFIKI845bktLWH_smw.jpg?width=640&amp;crop=smart&amp;auto=webp&amp;s=58dbe6b0f31c64ea6e881a64803c206fef50752e', 'width': 640, 'height': 320}, {'url': 'https://external-preview.redd.it/sdzt-fx5kPkYezyFYbQxT6Mh6VFIKI845bktLWH_smw.jpg?width=960&amp;crop=smart&amp;auto=webp&amp;s=c227041f1b293ff7e1b8c72438c5464e564bbd0a', 'width': 960, 'height': 480}], 'variants': {}, 'id': 'CzHQzoyjuku68E49W5OYAqat62sDz0TPXUEHWeqjP4M'}], 'enabled': False}",6,False,,,False,114,,{},"Games Workshop just released a totally new kind of paint. You can paint one coat and get a shade and highlight at the same time. It's pretty slick. I bought all in, personally, to help me get through my massive boardgame miniature backlog as you can speed paint large forces to a nice level very quickly. I thought this sub might be interested.

Currently all Games Workshop and Warhammer stores are doing demos of the paint in store, as well as a lot of regular FLGS. I highly suggest stopping in someplace and giving it a go.

Link below, plus there is a lot of buzz online for it already, too.

https://www.warhammer-community.com/2019/05/23/contrast-meet-the-rangegw-homepage-post-2fw-homepage-post-2/","&lt;!-- SC_OFF --&gt;&lt;div class=""md""&gt;&lt;p&gt;Games Workshop just released a totally new kind of paint. You can paint one coat and get a shade and highlight at the same time. It&amp;#39;s pretty slick. I bought all in, personally, to help me get through my massive boardgame miniature backlog as you can speed paint large forces to a nice level very quickly. I thought this sub might be interested.&lt;/p&gt;

&lt;p&gt;Currently all Games Workshop and Warhammer stores are doing demos of the paint in store, as well as a lot of regular FLGS. I highly suggest stopping in someplace and giving it a go.&lt;/p&gt;

&lt;p&gt;Link below, plus there is a lot of buzz online for it already, too.&lt;/p&gt;

&lt;p&gt;&lt;a href=""https://www.warhammer-community.com/2019/05/23/contrast-meet-the-rangegw-homepage-post-2fw-homepage-post-2/""&gt;https://www.warhammer-community.com/2019/05/23/contrast-meet-the-rangegw-homepage-post-2fw-homepage-post-2/&lt;/a&gt;&lt;/p&gt;
&lt;/div&gt;&lt;!-- SC_ON --&gt;",True,False,False,boardgames,t5_2qmjp,r/boardgames,1942592,public,,self,,,New Contrast Paints. Paint your miniature backlog in just one coat. Demo's available in store now.,0,114,https://www.reddit.com/r/boardgames/comments/byji0i/new_contrast_paints_paint_your_miniature_backlog/,[],,False,all_ads,6
[],,,False,StarSpangldBastard,,,[],,,,text,t2_3vrakzzh,False,,,False,False,,False,,False,1560140397.0,1560111597.0,,self.boardgames,0,False,0,{},False,False,byoldw,False,False,False,False,True,True,False,,,,[],,,dark,text,False,,{},False,,,,[],t3_byoldw,False,31,0,,False,all_ads,/r/boardgames/comments/byoldw/help_me_settle_a_stupid_board_game_related/,False,,,6,False,,,False,27,,{},"So basically the story is, I was playing a board game with a couple friends and at one point during the game a die had to be rolled. When I rolled the die, it hit one of the miniatures mid-roll. My friend instantly called ""interference"" and demanded I reroll. At first I thought he was joking, I've never heard of anything like that, but he claimed it was a universal rule for all board games and that I was an idiot for not knowing about it and thinking it was a dumb rule. Am I alone here or is this guy wrong? I get that if the die hits something mid roll it'll probably change the outcome but I really don't think that matters since as long as the die rolls, each side still has a 1/6 chance of turning up, unless somehow you're really crafty and can find a way to manipulate the outcome this way but I'd imagine you'd have to be a genius to actually pull something like that off","&lt;!-- SC_OFF --&gt;&lt;div class=""md""&gt;&lt;p&gt;So basically the story is, I was playing a board game with a couple friends and at one point during the game a die had to be rolled. When I rolled the die, it hit one of the miniatures mid-roll. My friend instantly called &amp;quot;interference&amp;quot; and demanded I reroll. At first I thought he was joking, I&amp;#39;ve never heard of anything like that, but he claimed it was a universal rule for all board games and that I was an idiot for not knowing about it and thinking it was a dumb rule. Am I alone here or is this guy wrong? I get that if the die hits something mid roll it&amp;#39;ll probably change the outcome but I really don&amp;#39;t think that matters since as long as the die rolls, each side still has a 1/6 chance of turning up, unless somehow you&amp;#39;re really crafty and can find a way to manipulate the outcome this way but I&amp;#39;d imagine you&amp;#39;d have to be a genius to actually pull something like that off&lt;/p&gt;
&lt;/div&gt;&lt;!-- SC_ON --&gt;",True,False,False,boardgames,t5_2qmjp,r/boardgames,1942592,public,,self,,,Help me settle a stupid board game related argument with my friends,0,27,https://www.reddit.com/r/boardgames/comments/byoldw/help_me_settle_a_stupid_board_game_related/,[],,False,all_ads,6
