[],,,False,Slanesh,,blood-rage,"[{'e': 'text', 't': 'Blood Rage'}]",,Blood Rage,dark,richtext,t2_gsjic,False,,,False,False,,False,,False,1560012197.0,1559983397.0,,youtube.com,0,False,0,{},False,False,by5yeo,False,False,False,False,True,False,False,,,,[],,,dark,text,False,"{'type': 'youtube.com', 'oembed': {'provider_url': 'https://www.youtube.com/', 'version': '1.0', 'title': 'A Transparent Look at Publishing and Retail w/ Jamey Stegmaier | Episode 102, the Covenant Cast', 'type': 'video', 'thumbnail_width': 480, 'height': 338, 'width': 600, 'html': '&lt;iframe width=""600"" height=""338"" src=""https://www.youtube.com/embed/lYCljWn9et8?feature=oembed&amp;enablejsapi=1"" frameborder=""0"" allow=""accelerometer; autoplay; encrypted-media; gyroscope; picture-in-picture"" allowfullscreen&gt;&lt;/iframe&gt;', 'author_name': 'Team Covenant', 'provider_name': 'YouTube', 'thumbnail_url': 'https://i.ytimg.com/vi/lYCljWn9et8/hqdefault.jpg', 'thumbnail_height': 360, 'author_url': 'https://www.youtube.com/user/CovenantTCG'}}","{'content': '&lt;iframe width=""600"" height=""338"" src=""https://www.youtube.com/embed/lYCljWn9et8?feature=oembed&amp;enablejsapi=1"" frameborder=""0"" allow=""accelerometer; autoplay; encrypted-media; gyroscope; picture-in-picture"" allowfullscreen&gt;&lt;/iframe&gt;', 'width': 600, 'scrolling': False, 'height': 338}",False,,,,[],t3_by5yeo,False,2,0,,False,all_ads,/r/boardgames/comments/by5yeo/covenant_interview_with_jamey_stegmaier_scythe/,False,rich:video,"{'images': [{'source': {'url': 'https://external-preview.redd.it/ikxI_7T2g4mk1tDUbozsAhKWtIPwiY_VTPpbuW-1c4Q.jpg?auto=webp&amp;s=62bae33d7872b86d2c6bb9e0657b3e163ccc88fb', 'width': 480, 'height': 360}, 'resolutions': [{'url': 'https://external-preview.redd.it/ikxI_7T2g4mk1tDUbozsAhKWtIPwiY_VTPpbuW-1c4Q.jpg?width=108&amp;crop=smart&amp;auto=webp&amp;s=2ece923c4ba33e2584794b6d23662249be7d35b1', 'width': 108, 'height': 81}, {'url': 'https://external-preview.redd.it/ikxI_7T2g4mk1tDUbozsAhKWtIPwiY_VTPpbuW-1c4Q.jpg?width=216&amp;crop=smart&amp;auto=webp&amp;s=aa64d59bdb30c70e316ae4ea756007f6d5bb8701', 'width': 216, 'height': 162}, {'url': 'https://external-preview.redd.it/ikxI_7T2g4mk1tDUbozsAhKWtIPwiY_VTPpbuW-1c4Q.jpg?width=320&amp;crop=smart&amp;auto=webp&amp;s=9e519b70f6add352e55c6a21e13726050760f539', 'width': 320, 'height': 240}], 'variants': {}, 'id': 'Yyb5I18HL0zT-kMX8U24eW4VCVa3lM1de5dtwpJofdU'}], 'enabled': False}",6,False,,,False,3,"{'type': 'youtube.com', 'oembed': {'provider_url': 'https://www.youtube.com/', 'version': '1.0', 'title': 'A Transparent Look at Publishing and Retail w/ Jamey Stegmaier | Episode 102, the Covenant Cast', 'type': 'video', 'thumbnail_width': 480, 'height': 338, 'width': 600, 'html': '&lt;iframe width=""600"" height=""338"" src=""https://www.youtube.com/embed/lYCljWn9et8?feature=oembed&amp;enablejsapi=1"" frameborder=""0"" allow=""accelerometer; autoplay; encrypted-media; gyroscope; picture-in-picture"" allowfullscreen&gt;&lt;/iframe&gt;', 'author_name': 'Team Covenant', 'provider_name': 'YouTube', 'thumbnail_url': 'https://i.ytimg.com/vi/lYCljWn9et8/hqdefault.jpg', 'thumbnail_height': 360, 'author_url': 'https://www.youtube.com/user/CovenantTCG'}}","{'content': '&lt;iframe width=""600"" height=""338"" src=""https://www.youtube.com/embed/lYCljWn9et8?feature=oembed&amp;enablejsapi=1"" frameborder=""0"" allow=""accelerometer; autoplay; encrypted-media; gyroscope; picture-in-picture"" allowfullscreen&gt;&lt;/iframe&gt;', 'width': 600, 'scrolling': False, 'media_domain_url': 'https://www.redditmedia.com/mediaembed/by5yeo', 'height': 338}",,,True,False,False,boardgames,t5_2qmjp,r/boardgames,1942592,public,,https://b.thumbs.redditmedia.com/nu8GydAL2Nr3JFaYbBgI-OqZHK33q5YY-9fNgswG06s.jpg,105.0,140.0,Covenant interview with Jamey Stegmaier (Scythe etc.) about supply chain and Wingspan,0,3,https://www.youtube.com/watch?v=lYCljWn9et8,[],,False,all_ads,6
[],,,False,40_Small_Mangos,,,[],,,,text,t2_f793qbc,False,,,False,False,,False,,False,1559992007.0,1559963207.0,,self.boardgames,0,False,0,{},False,False,by3c8b,False,False,False,False,True,True,False,,#edeff1,,"[{'e': 'text', 't': 'Question [ANSWERED]'}]",e9f90470-b792-11e8-b19d-0e341b525318,Question [ANSWERED],dark,richtext,False,,{},False,,,,[],t3_by3c8b,True,9,0,,False,all_ads,/r/boardgames/comments/by3c8b/did_we_win_war_of_the_ring_fairly/,False,,,6,False,,,False,4,,{},"So me and my friends spent a day playing war of the ring and me and one played as evil and the other two played good,on our third game we switched sides and me and my friend won by destroying the ring and so we put like all our dice that we could into moving the fellowship while we lured them into worrying about combat and we put all our hero/will of the west die into moving them and they never corrupted but the game lasted less than 40 mins and it does not feel right, so did me and my friend win fairly as good?","&lt;!-- SC_OFF --&gt;&lt;div class=""md""&gt;&lt;p&gt;So me and my friends spent a day playing war of the ring and me and one played as evil and the other two played good,on our third game we switched sides and me and my friend won by destroying the ring and so we put like all our dice that we could into moving the fellowship while we lured them into worrying about combat and we put all our hero/will of the west die into moving them and they never corrupted but the game lasted less than 40 mins and it does not feel right, so did me and my friend win fairly as good?&lt;/p&gt;
&lt;/div&gt;&lt;!-- SC_ON --&gt;",True,False,False,boardgames,t5_2qmjp,r/boardgames,1942592,public,,self,,,Did we win war of the ring fairly?,0,4,https://www.reddit.com/r/boardgames/comments/by3c8b/did_we_win_war_of_the_ring_fairly/,[],,False,all_ads,6
[],,,False,panuccispizzaboy,,,[],,,,text,t2_r1d95,False,,,False,False,,False,,False,1559956487.0,1559927687.0,,self.boardgames,0,False,0,{},False,False,bxx65g,False,False,False,False,True,True,False,,#edeff1,,"[{'e': 'text', 't': 'Question [ANSWERED]'}]",e9f90470-b792-11e8-b19d-0e341b525318,Question [ANSWERED],dark,richtext,False,,{},False,,,,[],t3_bxx65g,False,5,0,,False,all_ads,/r/boardgames/comments/bxx65g/posted_this_in_rgaming_and_they_said_i_would_have/,False,,,6,False,,,False,31,,{},"I hope this opening sentence doesn't push people away, but I bought this game from like a Walmart or Target or something like that around 2013ish. It came with four pre-con decks with their own unique synergies (I think one deck was elf based and they piggy-backed off each other to strengthen themselves, stuff like that.) You could play the decks against friends or the cool part was that you could play against the game itself with this separate, smaller deck that was set up, face down, into this tier-like configuration where you would flip over more and more cards as rounds went on to increase the difficulty. It sort of reminded me of MTG a little bit, but with that added teamwork bit. Thank y'all for the help in advance or just thank you for taking the time to read!","&lt;!-- SC_OFF --&gt;&lt;div class=""md""&gt;&lt;p&gt;I hope this opening sentence doesn&amp;#39;t push people away, but I bought this game from like a Walmart or Target or something like that around 2013ish. It came with four pre-con decks with their own unique synergies (I think one deck was elf based and they piggy-backed off each other to strengthen themselves, stuff like that.) You could play the decks against friends or the cool part was that you could play against the game itself with this separate, smaller deck that was set up, face down, into this tier-like configuration where you would flip over more and more cards as rounds went on to increase the difficulty. It sort of reminded me of MTG a little bit, but with that added teamwork bit. Thank y&amp;#39;all for the help in advance or just thank you for taking the time to read!&lt;/p&gt;
&lt;/div&gt;&lt;!-- SC_ON --&gt;",True,False,False,boardgames,t5_2qmjp,r/boardgames,1942592,public,,self,,,Posted this in r/gaming and they said I would have better luck here. Need help finding a card game.,0,31,https://www.reddit.com/r/boardgames/comments/bxx65g/posted_this_in_rgaming_and_they_said_i_would_have/,[],,False,all_ads,6
[],,,False,datingninja,,,[],,,,text,t2_oggpd,False,,,False,False,,False,,False,1559975783.0,1559946983.0,,self.boardgames,0,False,0,{},False,False,by0u1g,False,False,False,False,True,True,False,,,,[],,,dark,text,False,,{},False,,,,[],t3_by0u1g,False,51,0,,False,all_ads,/r/boardgames/comments/by0u1g/what_games_are_you_playing_tonight_this_weekend/,False,,,6,False,,,False,11,,{},I'm thinking Journey's in Middle-Earth.  Maybe read rules on Dark Souls the Card Game so I can jump in that finally.,"&lt;!-- SC_OFF --&gt;&lt;div class=""md""&gt;&lt;p&gt;I&amp;#39;m thinking Journey&amp;#39;s in Middle-Earth.  Maybe read rules on Dark Souls the Card Game so I can jump in that finally.&lt;/p&gt;
&lt;/div&gt;&lt;!-- SC_ON --&gt;",True,False,False,boardgames,t5_2qmjp,r/boardgames,1942592,public,,self,,,What games are you playing tonight? This weekend?,0,11,https://www.reddit.com/r/boardgames/comments/by0u1g/what_games_are_you_playing_tonight_this_weekend/,[],,False,all_ads,6
[],,,False,AevinPaos,,,[],,,,text,t2_oul04,False,,,False,False,,False,,False,1559967698.0,1559938898.0,,self.boardgames,0,False,0,{},False,False,bxzckn,False,False,False,False,True,True,False,,,,"[{'e': 'text', 't': 'COMC'}]",734914a6-426b-11e8-8511-0e863647358e,COMC,dark,richtext,False,,{},False,,,,[],t3_bxzckn,False,25,0,,False,all_ads,/r/boardgames/comments/bxzckn/comc_2_years_2_moves_and_2_kallaxes_later/,False,self,"{'images': [{'source': {'url': 'https://external-preview.redd.it/jZ03BSPLyRVZmbwKNjRDOLxQDgeNfbL0m25ow23qCLo.jpg?auto=webp&amp;s=69f879ccf2cc97cacafcc042f11787197889efdd', 'width': 2048, 'height': 1536}, 'resolutions': [{'url': 'https://external-preview.redd.it/jZ03BSPLyRVZmbwKNjRDOLxQDgeNfbL0m25ow23qCLo.jpg?width=108&amp;crop=smart&amp;auto=webp&amp;s=23c24720f427fa31d843c8311fe2a8bad76f5cd6', 'width': 108, 'height': 81}, {'url': 'https://external-preview.redd.it/jZ03BSPLyRVZmbwKNjRDOLxQDgeNfbL0m25ow23qCLo.jpg?width=216&amp;crop=smart&amp;auto=webp&amp;s=0d12dfd2b71b527129e6ad4e341f1a711c6d7ca9', 'width': 216, 'height': 162}, {'url': 'https://external-preview.redd.it/jZ03BSPLyRVZmbwKNjRDOLxQDgeNfbL0m25ow23qCLo.jpg?width=320&amp;crop=smart&amp;auto=webp&amp;s=e0c12daac6bcf85b11bcd08d8672a0c598330616', 'width': 320, 'height': 240}, {'url': 'https://external-preview.redd.it/jZ03BSPLyRVZmbwKNjRDOLxQDgeNfbL0m25ow23qCLo.jpg?width=640&amp;crop=smart&amp;auto=webp&amp;s=c08d41ae04713846dc7a738c7ad6cc812cf0459f', 'width': 640, 'height': 480}, {'url': 'https://external-preview.redd.it/jZ03BSPLyRVZmbwKNjRDOLxQDgeNfbL0m25ow23qCLo.jpg?width=960&amp;crop=smart&amp;auto=webp&amp;s=da6d3e5b392b23cc39da1b6f225b1d276bd63def', 'width': 960, 'height': 720}, {'url': 'https://external-preview.redd.it/jZ03BSPLyRVZmbwKNjRDOLxQDgeNfbL0m25ow23qCLo.jpg?width=1080&amp;crop=smart&amp;auto=webp&amp;s=0af410b6f9e609763f66dee1523534214c092fde', 'width': 1080, 'height': 810}], 'variants': {}, 'id': '4gFj4v2gufBD5hc46Xf3ODIBbKdws6j71aAdbLO4mm4'}], 'enabled': False}",6,False,,,False,18,,{},"First, [the collection.](https://imgur.com/a/fr9M1kO) The poor LEGO castle didn’t survive the move...

My partner and I started by buying **Pandemic** on the advice of our FLGS to kill a snowy evening in 2017 when friends were in town.

From there it snowballed. I purchased **Catan**, remembering it as a super-heavy euro from my youth. Next, **Eldritch Horror**, and the rest is history.

I’d like to find a few more thinky 2-player games, and maybe a grand 4X or even 18XX experience.

I’d happily never touch **Time Stories** or **Mice &amp; Mystics** ever again... in both cases, the gorgeous artwork, and (to me) inspired design just couldn’t save an absolute slog of a game, with underwhelming finishes.

I can’t wait to try **Who Goes There**!

My top few right now are **Lords of Vegas**, **Skull**, **Sushi Go Party**, **Great Western Trail**, and a custom **Bohnanza** I had manufactured for my father-in-law, swapping beans for the Topps baseball cards he collected as a kid.

Not pictured are the usual suspects, Risk, various Monopolies, Twister, Mad Gab etc.

Thanks for looking! I love this hobby, and the dearly held memories it’s created, and I’m grateful for this community of eager-to-help gamers and their recommendations making that possible.","&lt;!-- SC_OFF --&gt;&lt;div class=""md""&gt;&lt;p&gt;First, &lt;a href=""https://imgur.com/a/fr9M1kO""&gt;the collection.&lt;/a&gt; The poor LEGO castle didn’t survive the move...&lt;/p&gt;

&lt;p&gt;My partner and I started by buying &lt;strong&gt;Pandemic&lt;/strong&gt; on the advice of our FLGS to kill a snowy evening in 2017 when friends were in town.&lt;/p&gt;

&lt;p&gt;From there it snowballed. I purchased &lt;strong&gt;Catan&lt;/strong&gt;, remembering it as a super-heavy euro from my youth. Next, &lt;strong&gt;Eldritch Horror&lt;/strong&gt;, and the rest is history.&lt;/p&gt;

&lt;p&gt;I’d like to find a few more thinky 2-player games, and maybe a grand 4X or even 18XX experience.&lt;/p&gt;

&lt;p&gt;I’d happily never touch &lt;strong&gt;Time Stories&lt;/strong&gt; or &lt;strong&gt;Mice &amp;amp; Mystics&lt;/strong&gt; ever again... in both cases, the gorgeous artwork, and (to me) inspired design just couldn’t save an absolute slog of a game, with underwhelming finishes.&lt;/p&gt;

&lt;p&gt;I can’t wait to try &lt;strong&gt;Who Goes There&lt;/strong&gt;!&lt;/p&gt;

&lt;p&gt;My top few right now are &lt;strong&gt;Lords of Vegas&lt;/strong&gt;, &lt;strong&gt;Skull&lt;/strong&gt;, &lt;strong&gt;Sushi Go Party&lt;/strong&gt;, &lt;strong&gt;Great Western Trail&lt;/strong&gt;, and a custom &lt;strong&gt;Bohnanza&lt;/strong&gt; I had manufactured for my father-in-law, swapping beans for the Topps baseball cards he collected as a kid.&lt;/p&gt;

&lt;p&gt;Not pictured are the usual suspects, Risk, various Monopolies, Twister, Mad Gab etc.&lt;/p&gt;

&lt;p&gt;Thanks for looking! I love this hobby, and the dearly held memories it’s created, and I’m grateful for this community of eager-to-help gamers and their recommendations making that possible.&lt;/p&gt;
&lt;/div&gt;&lt;!-- SC_ON --&gt;",True,False,False,boardgames,t5_2qmjp,r/boardgames,1942592,public,,self,,,"[COMC] 2 Years, 2 Moves, and 2 Kallaxes Later",0,18,https://www.reddit.com/r/boardgames/comments/bxzckn/comc_2_years_2_moves_and_2_kallaxes_later/,[],,False,all_ads,6
[],,,False,Siberiapete,,,[],,,,text,t2_2uf39uba,False,,,False,False,,False,,False,1559963558.0,1559934758.0,,self.boardgames,0,1559936239.0,0,{},False,False,bxyk4n,False,False,False,False,True,True,False,,,,"[{'e': 'text', 't': 'COMC'}]",734914a6-426b-11e8-8511-0e863647358e,COMC,dark,richtext,False,,{},False,,,,[],t3_bxyk4n,False,31,0,,False,all_ads,/r/boardgames/comments/bxyk4n/comc_my_collection_that_continues_to_swell/,False,self,"{'images': [{'source': {'url': 'https://external-preview.redd.it/uzrvTIHKPyRkXU0HxSUBHuozvJa00W-UxoIV85W6cP8.jpg?auto=webp&amp;s=ed72a4dfcc9d6356efbe2af5cec46437e5c2c1e7', 'width': 1536, 'height': 2048}, 'resolutions': [{'url': 'https://external-preview.redd.it/uzrvTIHKPyRkXU0HxSUBHuozvJa00W-UxoIV85W6cP8.jpg?width=108&amp;crop=smart&amp;auto=webp&amp;s=2b6cc40f4f7ba5db5fd2a7e2d70a78486e6c2eb4', 'width': 108, 'height': 144}, {'url': 'https://external-preview.redd.it/uzrvTIHKPyRkXU0HxSUBHuozvJa00W-UxoIV85W6cP8.jpg?width=216&amp;crop=smart&amp;auto=webp&amp;s=f91e38a3d5b1b9984578962f066b1111aee7bf57', 'width': 216, 'height': 288}, {'url': 'https://external-preview.redd.it/uzrvTIHKPyRkXU0HxSUBHuozvJa00W-UxoIV85W6cP8.jpg?width=320&amp;crop=smart&amp;auto=webp&amp;s=d58857b2b5b4e771c97344cb292c17d64a5486a2', 'width': 320, 'height': 426}, {'url': 'https://external-preview.redd.it/uzrvTIHKPyRkXU0HxSUBHuozvJa00W-UxoIV85W6cP8.jpg?width=640&amp;crop=smart&amp;auto=webp&amp;s=f5f9b63aafe39f3defb3b2dbe9a05f3aebc509a6', 'width': 640, 'height': 853}, {'url': 'https://external-preview.redd.it/uzrvTIHKPyRkXU0HxSUBHuozvJa00W-UxoIV85W6cP8.jpg?width=960&amp;crop=smart&amp;auto=webp&amp;s=5432066b3bbe60545759bf496dafea1cc3664eb8', 'width': 960, 'height': 1280}, {'url': 'https://external-preview.redd.it/uzrvTIHKPyRkXU0HxSUBHuozvJa00W-UxoIV85W6cP8.jpg?width=1080&amp;crop=smart&amp;auto=webp&amp;s=39bf17be22351ab78a68e9b18fc402a1f8b00bea', 'width': 1080, 'height': 1440}], 'variants': {}, 'id': 'XkMfMUKZbPJNOasluSPWUuuPY-QNf4f9Ix8Pk5cnPIY'}], 'enabled': False}",6,False,,,False,20,,{},"https://imgur.com/a/FlX9Cb2


How long have I been into the hobby? I’ve been into tabletop games for almost 30 years. I got hooked with DnD, HeroQuest, Battlemasters, and Risk as a kid. Now that I make good money and my kids are involved, it just gives me a reason to continue on with it.

What would I change about my collection? I really wouldn’t change anything about my physical collection. I AM changing my habits of playing more of what I have instead of buying more of what I might play in the future. Between my various circles of friends, I try to introduce a new game each week. Whether it’s getting inexperienced gamers exposed to something new, getting experienced gamers a new game, or just a reason to open up a sealed game. 

Did I follow the rules correctly?","&lt;!-- SC_OFF --&gt;&lt;div class=""md""&gt;&lt;p&gt;&lt;a href=""https://imgur.com/a/FlX9Cb2""&gt;https://imgur.com/a/FlX9Cb2&lt;/a&gt;&lt;/p&gt;

&lt;p&gt;How long have I been into the hobby? I’ve been into tabletop games for almost 30 years. I got hooked with DnD, HeroQuest, Battlemasters, and Risk as a kid. Now that I make good money and my kids are involved, it just gives me a reason to continue on with it.&lt;/p&gt;

&lt;p&gt;What would I change about my collection? I really wouldn’t change anything about my physical collection. I AM changing my habits of playing more of what I have instead of buying more of what I might play in the future. Between my various circles of friends, I try to introduce a new game each week. Whether it’s getting inexperienced gamers exposed to something new, getting experienced gamers a new game, or just a reason to open up a sealed game. &lt;/p&gt;

&lt;p&gt;Did I follow the rules correctly?&lt;/p&gt;
&lt;/div&gt;&lt;!-- SC_ON --&gt;",True,False,False,boardgames,t5_2qmjp,r/boardgames,1942592,public,,self,,,[COMC] My collection that continues to swell,0,20,https://www.reddit.com/r/boardgames/comments/bxyk4n/comc_my_collection_that_continues_to_swell/,[],,False,all_ads,6
[],,,False,SprAwsmMan,,,[],,,,text,t2_92nug,False,,,False,False,,False,,False,1559984229.0,1559955429.0,,self.boardgames,0,1559955804.0,0,{},False,False,by27co,False,False,False,False,True,True,False,,,,[],,,dark,text,False,,{},False,,,,[],t3_by27co,False,3,0,,False,all_ads,/r/boardgames/comments/by27co/is_there_a_site_or_somewhere_i_can_go_to_find/,False,self,"{'images': [{'source': {'url': 'https://external-preview.redd.it/nmESpnDRVMR2h8pOvQC1c1PZoov4riTDOg_xWRvn3kI.jpg?auto=webp&amp;s=5d53f033c57d0ecd6106549a2abca34397e8608b', 'width': 685, 'height': 1024}, 'resolutions': [{'url': 'https://external-preview.redd.it/nmESpnDRVMR2h8pOvQC1c1PZoov4riTDOg_xWRvn3kI.jpg?width=108&amp;crop=smart&amp;auto=webp&amp;s=86a09bc68da46dba716e59d8054b7e6de3832b96', 'width': 108, 'height': 161}, {'url': 'https://external-preview.redd.it/nmESpnDRVMR2h8pOvQC1c1PZoov4riTDOg_xWRvn3kI.jpg?width=216&amp;crop=smart&amp;auto=webp&amp;s=bafc8c1c2bf34737506a4d58741dcebfaf999ad9', 'width': 216, 'height': 322}, {'url': 'https://external-preview.redd.it/nmESpnDRVMR2h8pOvQC1c1PZoov4riTDOg_xWRvn3kI.jpg?width=320&amp;crop=smart&amp;auto=webp&amp;s=ef13da1d63701885081fb93bb8421fddfa8f5fc5', 'width': 320, 'height': 478}, {'url': 'https://external-preview.redd.it/nmESpnDRVMR2h8pOvQC1c1PZoov4riTDOg_xWRvn3kI.jpg?width=640&amp;crop=smart&amp;auto=webp&amp;s=0a2b76d8973b53054d686cd2a8f63764351c7819', 'width': 640, 'height': 956}], 'variants': {}, 'id': '0NMSp_PQZi6g3xw2m1x088raZAnVJT7kLGXQM18mT6U'}], 'enabled': False}",6,False,,,False,5,,{},"Specifically looking for the dial used in a Cosmic Encounter expansion: Cosmic Eons ([this link shows the dial in action](https://geekandsundry.com/cosmic-eons-the-must-have-expansion-for-cosmic-encounter/)). It's my understanding the makers of Cosmic Encounter don't sell pieces separately - we've contacted them in hopes that's not exactly true. But in the mean time, I've been wondering what you do when you lose important pieces?

Where do you go to replace them or how do you play without them around?","&lt;!-- SC_OFF --&gt;&lt;div class=""md""&gt;&lt;p&gt;Specifically looking for the dial used in a Cosmic Encounter expansion: Cosmic Eons (&lt;a href=""https://geekandsundry.com/cosmic-eons-the-must-have-expansion-for-cosmic-encounter/""&gt;this link shows the dial in action&lt;/a&gt;). It&amp;#39;s my understanding the makers of Cosmic Encounter don&amp;#39;t sell pieces separately - we&amp;#39;ve contacted them in hopes that&amp;#39;s not exactly true. But in the mean time, I&amp;#39;ve been wondering what you do when you lose important pieces?&lt;/p&gt;

&lt;p&gt;Where do you go to replace them or how do you play without them around?&lt;/p&gt;
&lt;/div&gt;&lt;!-- SC_ON --&gt;",True,False,False,boardgames,t5_2qmjp,r/boardgames,1942592,public,,self,,,Is there a site or somewhere I can go to find boardgame pieces?,0,5,https://www.reddit.com/r/boardgames/comments/by27co/is_there_a_site_or_somewhere_i_can_go_to_find/,[],,False,all_ads,6
[],,,False,ward5150,,,[],,,,text,t2_fn331,False,,,False,False,,False,,False,1559988725.0,1559959925.0,,self.boardgames,0,False,0,{},False,False,by2v41,False,False,False,False,True,True,False,,,,[],,,dark,text,False,,{},False,,,,[],t3_by2v41,False,2,0,,False,all_ads,/r/boardgames/comments/by2v41/opinion_of_kemet_promo_tile_protective_aura_being/,False,,,6,False,,,False,4,,{},"This tile seems overpowered or am i crazy?? This tile cost 1 point and it prevents all damage outside of combat. This 1 cost power tile totally negates the ""initiative"" 4 point red power tile AND some insta kill DI cards. Just seems a lil too powerful! Am i alone in this??","&lt;!-- SC_OFF --&gt;&lt;div class=""md""&gt;&lt;p&gt;This tile seems overpowered or am i crazy?? This tile cost 1 point and it prevents all damage outside of combat. This 1 cost power tile totally negates the &amp;quot;initiative&amp;quot; 4 point red power tile AND some insta kill DI cards. Just seems a lil too powerful! Am i alone in this??&lt;/p&gt;
&lt;/div&gt;&lt;!-- SC_ON --&gt;",True,False,False,boardgames,t5_2qmjp,r/boardgames,1942592,public,,self,,,"Opinion of Kemet promo tile ""protective aura"" being too powerful",0,4,https://www.reddit.com/r/boardgames/comments/by2v41/opinion_of_kemet_promo_tile_protective_aura_being/,[],,False,all_ads,6
[],,,False,ArmenianChances,,,[],,,,text,t2_yj0alpc,False,,,False,False,,False,,False,1559933759.0,1559904959.0,,self.boardgames,0,False,0,{},False,False,bxt7fm,False,False,False,False,True,True,False,,,,[],,,dark,text,False,,{},False,,,,[],t3_bxt7fm,False,95,0,,False,all_ads,/r/boardgames/comments/bxt7fm/twilight_imperium_vs_star_warsrebellion/,False,,,6,False,,,False,67,,{},"I need some help deciding between these two games. I’ll be mostly playing with 4-5 people but also often play just 1v1. I absolutely love Star Wars, but would rather play a game I’ll really enjoy because of the gameplay than because of the IP. Any insight or comparisons between the games would be helpful and appreciated.","&lt;!-- SC_OFF --&gt;&lt;div class=""md""&gt;&lt;p&gt;I need some help deciding between these two games. I’ll be mostly playing with 4-5 people but also often play just 1v1. I absolutely love Star Wars, but would rather play a game I’ll really enjoy because of the gameplay than because of the IP. Any insight or comparisons between the games would be helpful and appreciated.&lt;/p&gt;
&lt;/div&gt;&lt;!-- SC_ON --&gt;",True,False,False,boardgames,t5_2qmjp,r/boardgames,1942592,public,,self,,,Twilight Imperium vs. Star Wars:Rebellion,0,67,https://www.reddit.com/r/boardgames/comments/bxt7fm/twilight_imperium_vs_star_warsrebellion/,[],,False,all_ads,6
